{
  "schema": "shieldkit-labs/p2/schedule-freeze/v1",
  "artifactId": "schedule-freeze:gate-b-direct-arithmetic-formula-envelope-v1",
  "status": "formula-envelope-only-unimplemented-premeasurement",
  "evidenceClassification": "not-evidence",
  "qualification": {
    "componentScope": "gate-b-formula-envelope-only",
    "selection": "none",
    "tupleRef": null,
    "fieldRanking": "none",
    "proofSystemRanking": "none",
    "protocolRanking": "none",
    "protocolRoles": [],
    "circleDomain": null,
    "deepStrategy": null,
    "soundnessEventDag": null
  },
  "fieldConstructions": [
    {
      "constructionId": "algebra-construction:m89-d2-x2-plus-1-v1",
      "fieldSpecRef": "field-spec:m89-d2",
      "futureDescriptorRef": null,
      "p": "618970019642690137449562111",
      "q": 89,
      "degree": 2,
      "definingPolynomialAscending": [
        "1",
        "0",
        "1"
      ],
      "quotientRelation": "x^2=-1",
      "codec": {
        "codecId": "codec:direct-power-basis-m89-d2-fixed-le-v1",
        "basis": "direct-power-basis",
        "coefficientOrder": "c0-to-cd-minus-1",
        "baseLimbEncoding": "fixed-width-unsigned-little-endian",
        "baseLimbBytes": 12,
        "elementBytes": 24,
        "modulusBitLength": 89,
        "unusedHighBits": 7,
        "unusedHighBitMaskHex": "fe",
        "highBitPolicy": "reject-before-numeric-decode",
        "coefficientRange": "reject-unless-0<=coefficient<p",
        "fullConsumption": true,
        "zeroHex": "000000000000000000000000000000000000000000000000",
        "oneHex": "010000000000000000000000000000000000000000000000",
        "towerCoordinates": "internal-only-never-wire-or-codec"
      },
      "descriptorResolution": "future-exact-descriptor-and-certificate-required-before-execution"
    },
    {
      "constructionId": "algebra-construction:m61-d3-x3-minus-5-v1",
      "fieldSpecRef": "field-spec:m61-d3",
      "futureDescriptorRef": null,
      "p": "2305843009213693951",
      "q": 61,
      "degree": 3,
      "definingPolynomialAscending": [
        "2305843009213693946",
        "0",
        "0",
        "1"
      ],
      "quotientRelation": "x^3=5",
      "codec": {
        "codecId": "codec:direct-power-basis-m61-d3-fixed-le-v1",
        "basis": "direct-power-basis",
        "coefficientOrder": "c0-to-cd-minus-1",
        "baseLimbEncoding": "fixed-width-unsigned-little-endian",
        "baseLimbBytes": 8,
        "elementBytes": 24,
        "modulusBitLength": 61,
        "unusedHighBits": 3,
        "unusedHighBitMaskHex": "e0",
        "highBitPolicy": "reject-before-numeric-decode",
        "coefficientRange": "reject-unless-0<=coefficient<p",
        "fullConsumption": true,
        "zeroHex": "000000000000000000000000000000000000000000000000",
        "oneHex": "010000000000000000000000000000000000000000000000",
        "towerCoordinates": "internal-only-never-wire-or-codec"
      },
      "descriptorResolution": "future-exact-descriptor-and-certificate-required-before-execution"
    },
    {
      "constructionId": "algebra-construction:m31-d5-x5-plus-2x-minus-1-v1",
      "fieldSpecRef": "field-spec:m31-d5",
      "futureDescriptorRef": null,
      "p": "2147483647",
      "q": 31,
      "degree": 5,
      "definingPolynomialAscending": [
        "2147483646",
        "2",
        "0",
        "0",
        "0",
        "1"
      ],
      "quotientRelation": "x^5=1-2x",
      "codec": {
        "codecId": "codec:direct-power-basis-m31-d5-fixed-le-v1",
        "basis": "direct-power-basis",
        "coefficientOrder": "c0-to-cd-minus-1",
        "baseLimbEncoding": "fixed-width-unsigned-little-endian",
        "baseLimbBytes": 4,
        "elementBytes": 20,
        "modulusBitLength": 31,
        "unusedHighBits": 1,
        "unusedHighBitMaskHex": "80",
        "highBitPolicy": "reject-before-numeric-decode",
        "coefficientRange": "reject-unless-0<=coefficient<p",
        "fullConsumption": true,
        "zeroHex": "0000000000000000000000000000000000000000",
        "oneHex": "0100000000000000000000000000000000000000",
        "towerCoordinates": "internal-only-never-wire-or-codec"
      },
      "descriptorResolution": "future-exact-descriptor-and-certificate-required-before-execution"
    },
    {
      "constructionId": "algebra-construction:m31-d6-x6-minus-5-v1",
      "fieldSpecRef": "field-spec:m31-d6",
      "futureDescriptorRef": null,
      "p": "2147483647",
      "q": 31,
      "degree": 6,
      "definingPolynomialAscending": [
        "2147483642",
        "0",
        "0",
        "0",
        "0",
        "0",
        "1"
      ],
      "quotientRelation": "x^6=5",
      "codec": {
        "codecId": "codec:direct-power-basis-m31-d6-fixed-le-v1",
        "basis": "direct-power-basis",
        "coefficientOrder": "c0-to-cd-minus-1",
        "baseLimbEncoding": "fixed-width-unsigned-little-endian",
        "baseLimbBytes": 4,
        "elementBytes": 24,
        "modulusBitLength": 31,
        "unusedHighBits": 1,
        "unusedHighBitMaskHex": "80",
        "highBitPolicy": "reject-before-numeric-decode",
        "coefficientRange": "reject-unless-0<=coefficient<p",
        "fullConsumption": true,
        "zeroHex": "000000000000000000000000000000000000000000000000",
        "oneHex": "010000000000000000000000000000000000000000000000",
        "towerCoordinates": "internal-only-never-wire-or-codec"
      },
      "descriptorResolution": "future-exact-descriptor-and-certificate-required-before-execution"
    }
  ],
  "arms": [
    {
      "armId": "arm:canonical:m89-d2-canonical-schoolbook-v1",
      "constructionId": "algebra-construction:m89-d2-x2-plus-1-v1",
      "fieldSpecRef": "field-spec:m89-d2",
      "codecId": "codec:direct-power-basis-m89-d2-fixed-le-v1",
      "trackId": "track:canonical-schoolbook",
      "algorithmId": "algorithm:m89-d2-canonical-schoolbook-v1",
      "formula": {
        "formulaId": "formula:m89-d2-canonical-schoolbook-v1",
        "family": "canonical-schoolbook",
        "dagSteps": [
          "Ck=sum(i+j=k,a_i*b_j) for k=0..2",
          "square-Ck=sum(i<=j;i+j=k,(i==j?a_i*a_i:2*a_i*a_j))",
          "reduce-direct-product=(C0-C2,C1)"
        ],
        "constants": [
          {
            "label": "minus-one",
            "value": "-1",
            "role": "direct-reduction"
          }
        ],
        "matrices": [],
        "maps": [],
        "countDerivation": {
          "multiply": {
            "op": "multiply",
            "args": [
              {
                "op": "degree"
              },
              {
                "op": "degree"
              }
            ]
          },
          "square": {
            "op": "add",
            "args": [
              {
                "op": "degree"
              },
              {
                "op": "pair-count"
              }
            ]
          }
        },
        "reduction": {
          "stage": "after-extension-product-before-relation-add-or-equality",
          "formula": "(C0-C2,C1)"
        },
        "divisionPolicy": "fixed-canonical-inverse-scalar-multiplication-only;OP_DIV-forbidden",
        "dagIntegrity": "every-declared-node-reaches-an-output;no-optional-cse-or-dead-node"
      },
      "declaredVariableBaseCounts": {
        "multiply": 4,
        "square": 3,
        "interpretation": "variable-variable-base-Fp-multiplications-only-not-opcode-byte-stack-cost-or-rank-lower-bound"
      },
      "relationMapping": {
        "eMac": "relation:e-mac=mul-once-then-add-C-and-compare-D",
        "eSquareMac": "relation:e-square-mac=square-once-then-add-C-and-compare-D",
        "eInverseCheck": "relation:e-inverse-check=reject-zero-A-then-verify-mul-A-H-equals-one-only-no-inverse-calculation",
        "malformed": "all-malformed-cases-reject-at-parser-before-selected-arm"
      },
      "parserBeforeArithmetic": true,
      "executionStatus": "closed-unimplemented-premeasurement",
      "proofObligations": [
        "symbolic-DAG-equals-direct-polynomial-quotient-relation",
        "direct-power-basis-codec-round-trip-is-unchanged",
        "parser-and-canonicality-reject-before-selected-arm",
        "all-declared-DAG-nodes-reach-the-declared-output",
        "no-OP_DIV-and-all-fixed-inverses-are-canonical-field-scalars"
      ]
    },
    {
      "armId": "arm:canonical:m61-d3-canonical-schoolbook-v1",
      "constructionId": "algebra-construction:m61-d3-x3-minus-5-v1",
      "fieldSpecRef": "field-spec:m61-d3",
      "codecId": "codec:direct-power-basis-m61-d3-fixed-le-v1",
      "trackId": "track:canonical-schoolbook",
      "algorithmId": "algorithm:m61-d3-canonical-schoolbook-v1",
      "formula": {
        "formulaId": "formula:m61-d3-canonical-schoolbook-v1",
        "family": "canonical-schoolbook",
        "dagSteps": [
          "Ck=sum(i+j=k,a_i*b_j) for k=0..4",
          "square-Ck=sum(i<=j;i+j=k,(i==j?a_i*a_i:2*a_i*a_j))",
          "reduce-direct-product=(C0+5C3,C1+5C4,C2)"
        ],
        "constants": [
          {
            "label": "five",
            "value": "5",
            "role": "direct-reduction"
          }
        ],
        "matrices": [],
        "maps": [],
        "countDerivation": {
          "multiply": {
            "op": "multiply",
            "args": [
              {
                "op": "degree"
              },
              {
                "op": "degree"
              }
            ]
          },
          "square": {
            "op": "add",
            "args": [
              {
                "op": "degree"
              },
              {
                "op": "pair-count"
              }
            ]
          }
        },
        "reduction": {
          "stage": "after-extension-product-before-relation-add-or-equality",
          "formula": "(C0+5C3,C1+5C4,C2)"
        },
        "divisionPolicy": "fixed-canonical-inverse-scalar-multiplication-only;OP_DIV-forbidden",